{
  "avoid_list": [],
  "decisions": [],
  "global_warnings": [
    {
      "code": "EMPTY_PLANNER_INPUT",
      "message": "Planner received no candidates from scanner handoff.",
      "severity": "error"
    },
    {
      "code": "FALLBACK_WATCHLIST_ENABLED",
      "message": "Prod zero-result streak detected. Applied fallback watchlist from dev baseline (source_run=RUN-A790D56A).",
      "severity": "warning"
    },
    {
      "code": "EXCEPTION_LEADERS_ENABLED",
      "message": "Planner attached bear-market exception leaders from rejected candidates for follow-up tracking.",
      "severity": "warning"
    }
  ],
  "produced_at": "2026-04-09T16:27:12.117644+00:00",
  "run_context": {
    "as_of_date": "2026-04-10",
    "code_version": "bridge-v1",
    "created_at": "2026-04-09T16:26:19.961218+00:00",
    "market": "KOSDAQ",
    "model_version": "legacy",
    "run_id": "RUN-1C6F4C52",
    "strategy_version": "legacy-ui-v1"
  },
  "watchlist": [
    "095340.KQ",
    "028300.KQ",
    "100790.KQ",
    "241520.KQ",
    "347700.KQ",
    "086450.KQ",
    "073490.KQ"
  ],
  "watchlist_meta": [
    {
      "expires_at": "2026-04-12T16:27:12.865066+00:00",
      "generated_at": "2026-04-09T16:27:12.865066+00:00",
      "horizon_days": 3,
      "reason": "prod_zero_streak_alert",
      "risk_label": "HIGH_RISK_FALLBACK",
      "source_profile": "dev",
      "source_run_id": "RUN-A790D56A",
      "stock_name": "ISC",
      "ticker": "095340.KQ"
    },
    {
      "expires_at": "2026-04-12T16:27:12.865066+00:00",
      "generated_at": "2026-04-09T16:27:12.865066+00:00",
      "horizon_days": 3,
      "reason": "prod_zero_streak_alert",
      "risk_label": "HIGH_RISK_FALLBACK",
      "source_profile": "dev",
      "source_run_id": "RUN-A790D56A",
      "stock_name": "HLB",
      "ticker": "028300.KQ"
    },
    {
      "alpha_score": 52.0,
      "conviction_score": 58.9,
      "entry_reference_price": null,
      "exception_score": 80.0,
      "expires_at": "2026-04-12T16:27:13.520903+00:00",
      "generated_at": "2026-04-09T16:27:13.520903+00:00",
      "horizon_days": 3,
      "market_gate": "RED",
      "prob_5": 15.6,
      "prob_clean": 18.6,
      "profile_adjustment": 10.0,
      "profile_avg_5d_pct": 3.056768558951961,
      "profile_confidence": 0.602,
      "profile_policy": "POSITIVE",
      "profile_signals": 3,
      "profile_win_5d_pct": 100.0,
      "real_trend": "UP",
      "reason": "exception_leader_watchlist",
      "regime": "BEAR",
      "reject_reason": "precision_gate_t3_low_ml_support",
      "risk_label": "EXCEPTION_LEADER",
      "source_profile": "exception_leader",
      "stock_name": "미래에셋벤처투자",
      "ticker": "100790.KQ",
      "tier_sort": 3
    },
    {
      "alpha_score": 27.0,
      "conviction_score": 0.0,
      "entry_reference_price": null,
      "exception_score": 76.0,
      "expires_at": "2026-04-12T16:27:13.520903+00:00",
      "generated_at": "2026-04-09T16:27:13.520903+00:00",
      "horizon_days": 3,
      "market_gate": "RED",
      "prob_5": 0.0,
      "prob_clean": 0.0,
      "profile_adjustment": 22.0,
      "profile_avg_5d_pct": 37.44343891402715,
      "profile_confidence": 0.602,
      "profile_policy": "POSITIVE",
      "profile_signals": 3,
      "profile_win_5d_pct": 100.0,
      "real_trend": "UP",
      "reason": "exception_leader_watchlist",
      "regime": "BEAR",
      "reject_reason": "kr_hard_filter_fail",
      "risk_label": "EXCEPTION_LEADER",
      "source_profile": "exception_leader",
      "stock_name": "DSC인베스트먼트",
      "ticker": "241520.KQ",
      "tier_sort": 3
    },
    {
      "alpha_score": 30.0,
      "conviction_score": 0.0,
      "entry_reference_price": null,
      "exception_score": 76.0,
      "expires_at": "2026-04-12T16:27:13.520903+00:00",
      "generated_at": "2026-04-09T16:27:13.520903+00:00",
      "horizon_days": 3,
      "market_gate": "RED",
      "prob_5": 0.0,
      "prob_clean": 0.0,
      "profile_adjustment": 22.0,
      "profile_avg_5d_pct": 55.1304347826087,
      "profile_confidence": 0.602,
      "profile_policy": "POSITIVE",
      "profile_signals": 3,
      "profile_win_5d_pct": 100.0,
      "real_trend": "UP",
      "reason": "exception_leader_watchlist",
      "regime": "BEAR",
      "reject_reason": "kr_hard_filter_fail",
      "risk_label": "EXCEPTION_LEADER",
      "source_profile": "exception_leader",
      "stock_name": "스피어",
      "ticker": "347700.KQ",
      "tier_sort": 3
    },
    {
      "alpha_score": 57.0,
      "conviction_score": 57.3,
      "entry_reference_price": null,
      "exception_score": 72.8,
      "expires_at": "2026-04-12T16:27:13.520903+00:00",
      "generated_at": "2026-04-09T16:27:13.520903+00:00",
      "horizon_days": 3,
      "market_gate": "RED",
      "prob_5": 18.9,
      "prob_clean": 22.5,
      "profile_adjustment": 8.8,
      "profile_avg_5d_pct": 0.3882418191902381,
      "profile_confidence": 0.602,
      "profile_policy": "POSITIVE",
      "profile_signals": 3,
      "profile_win_5d_pct": 100.0,
      "real_trend": "UP",
      "reason": "exception_leader_watchlist",
      "regime": "BEAR",
      "reject_reason": "precision_gate_t3_low_ml_support",
      "risk_label": "EXCEPTION_LEADER",
      "source_profile": "exception_leader",
      "stock_name": "동국제약",
      "ticker": "086450.KQ",
      "tier_sort": 3
    },
    {
      "alpha_score": 23.0,
      "conviction_score": 0.0,
      "entry_reference_price": null,
      "exception_score": 69.2,
      "expires_at": "2026-04-12T16:27:13.520903+00:00",
      "generated_at": "2026-04-09T16:27:13.520903+00:00",
      "horizon_days": 3,
      "market_gate": "RED",
      "prob_5": 0.0,
      "prob_clean": 0.0,
      "profile_adjustment": 15.2,
      "profile_avg_5d_pct": 12.300319488817893,
      "profile_confidence": 0.602,
      "profile_policy": "POSITIVE",
      "profile_signals": 3,
      "profile_win_5d_pct": 100.0,
      "real_trend": "UP",
      "reason": "exception_leader_watchlist",
      "regime": "BEAR",
      "reject_reason": "kr_hard_filter_fail",
      "risk_label": "EXCEPTION_LEADER",
      "source_profile": "exception_leader",
      "stock_name": "이노와이어리스",
      "ticker": "073490.KQ",
      "tier_sort": 3
    }
  ]
}