{
  "avoid_list": [],
  "decisions": [],
  "global_warnings": [
    {
      "code": "EMPTY_PLANNER_INPUT",
      "message": "Planner received no candidates from scanner handoff.",
      "severity": "error"
    }
  ],
  "produced_at": "2026-03-31T08:44:07.105081+00:00",
  "run_context": {
    "as_of_date": "2026-03-31",
    "code_version": "bridge-v1",
    "created_at": "2026-03-31T08:44:06.371938+00:00",
    "market": "KOSDAQ",
    "model_version": "legacy",
    "run_id": "RUN-CC26BA3E",
    "strategy_version": "legacy-ui-v1"
  },
  "watchlist": [],
  "watchlist_meta": []
}