{
  "avoid_list": [
    "079550.KS"
  ],
  "decisions": [
    {
      "alpha_score": null,
      "confidence": 0.767,
      "decision": "WATCHLIST",
      "decision_score": 73.4,
      "entry_reference_price": null,
      "evidence_refs": [
        "scanner_handoff.json",
        "aggregation_handoff.json",
        "backtest_handoff.json",
        "market_context_handoff.json"
      ],
      "phase25_recommended_threshold": null,
      "phase25_shadow_prob": null,
      "phase25_shadow_variant": "",
      "phase25_variant": "",
      "priority_rank": 1,
      "prob_5": 23.0,
      "prob_clean": 32.8,
      "rationale": [
        "scanner_score=73.4",
        "rank=1",
        "전략: 🚀 Momentum | Ranker:6.9%",
        "추세: UP"
      ],
      "real_trend": "UP",
      "realized_outcome_ref": "realized_outcomes.json#012450.KS",
      "scan_mode": "",
      "stock_name": "한화에어로스페이스",
      "strategy_family": "",
      "ticker": "012450.KS",
      "warnings": []
    },
    {
      "alpha_score": null,
      "confidence": 0.626,
      "decision": "AVOID",
      "decision_score": 45.2,
      "entry_reference_price": null,
      "evidence_refs": [
        "scanner_handoff.json",
        "aggregation_handoff.json",
        "backtest_handoff.json",
        "market_context_handoff.json"
      ],
      "phase25_recommended_threshold": null,
      "phase25_shadow_prob": null,
      "phase25_shadow_variant": "",
      "phase25_variant": "",
      "priority_rank": 2,
      "prob_5": 19.5,
      "prob_clean": 26.7,
      "rationale": [
        "scanner_score=45.2",
        "rank=2",
        "전략: 🚀 Momentum | Ranker:2.3%",
        "추세: UP"
      ],
      "real_trend": "UP",
      "realized_outcome_ref": "realized_outcomes.json#079550.KS",
      "scan_mode": "",
      "stock_name": "LIG넥스원",
      "strategy_family": "",
      "ticker": "079550.KS",
      "warnings": [
        {
          "code": "LOW_DECISION_SCORE",
          "message": "079550.KS has low decision score (45.2).",
          "severity": "warning"
        }
      ]
    }
  ],
  "global_warnings": [
    {
      "code": "LOW_QUALITY_INPUT",
      "message": "Planner confidence reduced due to weak candidate ratio.",
      "severity": "warning"
    },
    {
      "code": "EXCEPTION_LEADERS_ENABLED",
      "message": "Planner attached bear-market exception leaders from rejected candidates for follow-up tracking.",
      "severity": "warning"
    }
  ],
  "produced_at": "2026-04-07T22:49:21.932084+00:00",
  "run_context": {
    "as_of_date": "2026-04-08",
    "code_version": "bridge-v1",
    "created_at": "2026-04-07T22:49:19.921596+00:00",
    "market": "KOSPI",
    "model_version": "legacy",
    "run_id": "RUN-7242D634",
    "strategy_version": "legacy-ui-v1"
  },
  "watchlist": [
    "012450.KS",
    "009150.KS",
    "032830.KS",
    "272210.KS",
    "353200.KS",
    "006260.KS",
    "047810.KS"
  ],
  "watchlist_meta": [
    {
      "alpha_score": 55.0,
      "conviction_score": 62.8,
      "entry_reference_price": null,
      "exception_score": 113.0,
      "expires_at": "2026-04-10T22:49:22.630871+00:00",
      "generated_at": "2026-04-07T22:49:22.630871+00:00",
      "horizon_days": 3,
      "market_gate": "GREEN",
      "prob_5": 20.2,
      "prob_clean": 27.7,
      "profile_adjustment": 22.0,
      "profile_avg_5d_pct": 34.89394144219717,
      "profile_confidence": 1.0,
      "profile_policy": "POSITIVE",
      "profile_signals": 14,
      "profile_win_5d_pct": 78.57142857142857,
      "real_trend": "UP",
      "reason": "exception_leader_watchlist",
      "regime": "BULL",
      "reject_reason": "precision_gate_t3_low_ml_support",
      "risk_label": "EXCEPTION_LEADER",
      "source_profile": "exception_leader",
      "stock_name": "삼성전기",
      "ticker": "009150.KS",
      "tier_sort": 3
    },
    {
      "alpha_score": 52.0,
      "conviction_score": 59.8,
      "entry_reference_price": null,
      "exception_score": 105.0,
      "expires_at": "2026-04-10T22:49:22.630871+00:00",
      "generated_at": "2026-04-07T22:49:22.630871+00:00",
      "horizon_days": 3,
      "market_gate": "GREEN",
      "prob_5": 23.7,
      "prob_clean": 31.0,
      "profile_adjustment": 22.0,
      "profile_avg_5d_pct": 9.707650627575386,
      "profile_confidence": 1.0,
      "profile_policy": "POSITIVE",
      "profile_signals": 15,
      "profile_win_5d_pct": 80.0,
      "real_trend": "UP",
      "reason": "exception_leader_watchlist",
      "regime": "BULL",
      "reject_reason": "precision_gate_t3_low_ml_support",
      "risk_label": "EXCEPTION_LEADER",
      "source_profile": "exception_leader",
      "stock_name": "삼성생명",
      "ticker": "032830.KS",
      "tier_sort": 3
    },
    {
      "alpha_score": 47.0,
      "conviction_score": 58.9,
      "entry_reference_price": null,
      "exception_score": 105.0,
      "expires_at": "2026-04-10T22:49:22.630871+00:00",
      "generated_at": "2026-04-07T22:49:22.630871+00:00",
      "horizon_days": 3,
      "market_gate": "GREEN",
      "prob_5": 20.4,
      "prob_clean": 27.5,
      "profile_adjustment": 22.0,
      "profile_avg_5d_pct": 14.532965389335972,
      "profile_confidence": 1.0,
      "profile_policy": "POSITIVE",
      "profile_signals": 12,
      "profile_win_5d_pct": 91.66666666666666,
      "real_trend": "UP",
      "reason": "exception_leader_watchlist",
      "regime": "BULL",
      "reject_reason": "precision_gate_t3_low_ml_support",
      "risk_label": "EXCEPTION_LEADER",
      "source_profile": "exception_leader",
      "stock_name": "한화시스템",
      "ticker": "272210.KS",
      "tier_sort": 3
    },
    {
      "alpha_score": 45.0,
      "conviction_score": 58.5,
      "entry_reference_price": null,
      "exception_score": 105.0,
      "expires_at": "2026-04-10T22:49:22.630871+00:00",
      "generated_at": "2026-04-07T22:49:22.630871+00:00",
      "horizon_days": 3,
      "market_gate": "GREEN",
      "prob_5": 26.4,
      "prob_clean": 35.6,
      "profile_adjustment": 22.0,
      "profile_avg_5d_pct": 13.56521739130434,
      "profile_confidence": 0.954,
      "profile_policy": "POSITIVE",
      "profile_signals": 8,
      "profile_win_5d_pct": 100.0,
      "real_trend": "UP",
      "reason": "exception_leader_watchlist",
      "regime": "BULL",
      "reject_reason": "precision_gate_t3_low_ml_support",
      "risk_label": "EXCEPTION_LEADER",
      "source_profile": "exception_leader",
      "stock_name": "대덕전자",
      "ticker": "353200.KS",
      "tier_sort": 3
    },
    {
      "alpha_score": 49.0,
      "conviction_score": 58.6,
      "entry_reference_price": null,
      "exception_score": 99.3,
      "expires_at": "2026-04-10T22:49:22.630871+00:00",
      "generated_at": "2026-04-07T22:49:22.630871+00:00",
      "horizon_days": 3,
      "market_gate": "GREEN",
      "prob_5": 22.2,
      "prob_clean": 25.5,
      "profile_adjustment": 16.3,
      "profile_avg_5d_pct": 8.582052626492384,
      "profile_confidence": 1.0,
      "profile_policy": "POSITIVE",
      "profile_signals": 12,
      "profile_win_5d_pct": 75.0,
      "real_trend": "UP",
      "reason": "exception_leader_watchlist",
      "regime": "BULL",
      "reject_reason": "precision_gate_t3_low_ml_support",
      "risk_label": "EXCEPTION_LEADER",
      "source_profile": "exception_leader",
      "stock_name": "LS",
      "ticker": "006260.KS",
      "tier_sort": 3
    },
    {
      "alpha_score": 59.0,
      "conviction_score": 64.4,
      "entry_reference_price": null,
      "exception_score": 98.0,
      "expires_at": "2026-04-10T22:49:22.630871+00:00",
      "generated_at": "2026-04-07T22:49:22.630871+00:00",
      "horizon_days": 3,
      "market_gate": "GREEN",
      "prob_5": 18.9,
      "prob_clean": 30.1,
      "profile_adjustment": 15.0,
      "profile_avg_5d_pct": 3.4207663687721674,
      "profile_confidence": 1.0,
      "profile_policy": "POSITIVE",
      "profile_signals": 12,
      "profile_win_5d_pct": 91.66666666666666,
      "real_trend": "UP",
      "reason": "exception_leader_watchlist",
      "regime": "BULL",
      "reject_reason": "precision_gate_t3_low_ml_support",
      "risk_label": "EXCEPTION_LEADER",
      "source_profile": "exception_leader",
      "stock_name": "한국항공우주",
      "ticker": "047810.KS",
      "tier_sort": 3
    }
  ]
}