{
  "avoid_list": [],
  "decisions": [
    {
      "confidence": 0.95,
      "decision": "PRIORITY_WATCHLIST",
      "evidence_refs": [
        "scanner_handoff.json",
        "aggregation_handoff.json",
        "backtest_handoff.json",
        "market_context_handoff.json"
      ],
      "priority_rank": 1,
      "rationale": [
        "scanner_score=115.0",
        "rank=1",
        "전략: 🚀 Momentum | ⚡ 단기과열(강세)",
        "추세: UP"
      ],
      "realized_outcome_ref": "realized_outcomes.json#098070.KQ",
      "ticker": "098070.KQ",
      "warnings": []
    },
    {
      "confidence": 0.937,
      "decision": "PRIORITY_WATCHLIST",
      "evidence_refs": [
        "scanner_handoff.json",
        "aggregation_handoff.json",
        "backtest_handoff.json",
        "market_context_handoff.json"
      ],
      "priority_rank": 2,
      "rationale": [
        "scanner_score=97.4",
        "rank=2",
        "전략: 🚀 Momentum | ⚡ 단기과열(강세)",
        "추세: UP"
      ],
      "realized_outcome_ref": "realized_outcomes.json#137950.KQ",
      "ticker": "137950.KQ",
      "warnings": []
    },
    {
      "confidence": 0.87,
      "decision": "PRIORITY_WATCHLIST",
      "evidence_refs": [
        "scanner_handoff.json",
        "aggregation_handoff.json",
        "backtest_handoff.json",
        "market_context_handoff.json"
      ],
      "priority_rank": 3,
      "rationale": [
        "scanner_score=83.9",
        "rank=3",
        "전략: 🚀 Momentum | ⚡ 단기과열(강세)",
        "추세: UP"
      ],
      "realized_outcome_ref": "realized_outcomes.json#289080.KQ",
      "ticker": "289080.KQ",
      "warnings": []
    },
    {
      "confidence": 0.867,
      "decision": "PRIORITY_WATCHLIST",
      "evidence_refs": [
        "scanner_handoff.json",
        "aggregation_handoff.json",
        "backtest_handoff.json",
        "market_context_handoff.json"
      ],
      "priority_rank": 4,
      "rationale": [
        "scanner_score=83.3",
        "rank=4",
        "전략: 🚀 Momentum",
        "추세: UP"
      ],
      "realized_outcome_ref": "realized_outcomes.json#476060.KQ",
      "ticker": "476060.KQ",
      "warnings": []
    }
  ],
  "global_warnings": [],
  "produced_at": "2026-03-30T22:56:38.847186+00:00",
  "run_context": {
    "as_of_date": "2026-03-31",
    "code_version": "bridge-v1",
    "created_at": "2026-03-30T22:56:36.775333+00:00",
    "market": "KOSDAQ",
    "model_version": "legacy",
    "run_id": "RUN-22964100",
    "strategy_version": "legacy-ui-v1"
  },
  "watchlist": [
    "098070.KQ",
    "137950.KQ",
    "289080.KQ",
    "476060.KQ"
  ],
  "watchlist_meta": []
}