{
  "avoid_list": [
    "050890.KQ",
    "089970.KQ"
  ],
  "decisions": [
    {
      "alpha_score": null,
      "confidence": 0.95,
      "decision": "AVOID",
      "decision_score": 100.0,
      "entry_reference_price": null,
      "evidence_refs": [
        "scanner_handoff.json",
        "aggregation_handoff.json",
        "backtest_handoff.json",
        "market_context_handoff.json"
      ],
      "phase25_prob": 3.5,
      "phase25_recommended_threshold": 25.0,
      "phase25_shadow_prob": 45.5,
      "phase25_shadow_variant": "phase25_kr_swing_lightgbm",
      "phase25_variant": "phase25_kr_swing_xgboost",
      "primary_theme": "통신/네트워크",
      "priority_rank": 1,
      "prob_5": 24.2,
      "prob_clean": 33.5,
      "rationale": [
        "scanner_score=100.0",
        "rank=1",
        "전략: 🚀 Momentum | ⚡ 단기과열(강세) | Ranker:35.0%",
        "추세: UP",
        "theme=통신/네트워크",
        "phase25_swing_gate=3.5<25.0"
      ],
      "real_trend": "UP",
      "realized_outcome_ref": "realized_outcomes.json#050890.KQ",
      "scan_mode": "SWING",
      "secondary_themes": [],
      "stock_name": "쏠리드",
      "strategy_family": "KR_CORE",
      "theme_inference_status": "inferred",
      "theme_rationale": [
        "THEME_LEADER_TOP1"
      ],
      "theme_risk": [
        "PHASE25_SWING_BELOW_THRESHOLD_HARD"
      ],
      "theme_routing_path": "core_only",
      "theme_source": "stock_master",
      "ticker": "050890.KQ",
      "warnings": []
    },
    {
      "alpha_score": null,
      "confidence": 0.779,
      "decision": "AVOID",
      "decision_score": 65.8,
      "entry_reference_price": null,
      "evidence_refs": [
        "scanner_handoff.json",
        "aggregation_handoff.json",
        "backtest_handoff.json",
        "market_context_handoff.json"
      ],
      "phase25_prob": 3.1,
      "phase25_recommended_threshold": 25.0,
      "phase25_shadow_prob": 45.5,
      "phase25_shadow_variant": "phase25_kr_swing_lightgbm",
      "phase25_variant": "phase25_kr_swing_xgboost",
      "primary_theme": "unclassified",
      "priority_rank": 2,
      "prob_5": 19.4,
      "prob_clean": 41.1,
      "rationale": [
        "scanner_score=65.8",
        "rank=2",
        "전략: 🚀 Momentum | Ranker:35.0%",
        "추세: UP",
        "phase25_swing_gate=3.1<25.0"
      ],
      "real_trend": "UP",
      "realized_outcome_ref": "realized_outcomes.json#089970.KQ",
      "scan_mode": "SWING",
      "secondary_themes": [],
      "stock_name": "브이엠",
      "strategy_family": "KR_CORE",
      "theme_inference_status": "blank",
      "theme_rationale": [],
      "theme_risk": [
        "PHASE25_SWING_BELOW_THRESHOLD_HARD"
      ],
      "theme_routing_path": "core_only",
      "theme_source": "stock_master",
      "ticker": "089970.KQ",
      "warnings": []
    }
  ],
  "global_warnings": [
    {
      "code": "EXCEPTION_LEADERS_ENABLED",
      "message": "Planner attached bear-market exception leaders from rejected candidates for follow-up tracking.",
      "severity": "warning"
    }
  ],
  "produced_at": "2026-04-10T01:48:33.665907+00:00",
  "run_context": {
    "as_of_date": "2026-04-10",
    "code_version": "bridge-v1",
    "created_at": "2026-04-10T01:47:36.895108+00:00",
    "market": "KOSDAQ",
    "model_version": "legacy",
    "run_id": "RUN-2BDAB33D",
    "strategy_version": "legacy-ui-v1"
  },
  "watchlist": [
    "058470.KQ",
    "086520.KQ",
    "277810.KQ",
    "357580.KQ",
    "000250.KQ",
    "417840.KQ"
  ],
  "watchlist_meta": [
    {
      "alpha_score": 51.0,
      "conviction_score": 57.9,
      "entry_reference_price": null,
      "exception_score": 91.0,
      "expires_at": "2026-04-13T01:48:34.501847+00:00",
      "generated_at": "2026-04-10T01:48:34.501847+00:00",
      "horizon_days": 3,
      "market_gate": "GREEN",
      "primary_theme": "반도체",
      "prob_5": 22.6,
      "prob_clean": 28.2,
      "profile_adjustment": 22.0,
      "profile_avg_5d_pct": 14.276735386623399,
      "profile_confidence": 1.0,
      "profile_policy": "POSITIVE",
      "profile_signals": 9,
      "profile_win_5d_pct": 100.0,
      "real_trend": "UP",
      "reason": "exception_leader_watchlist",
      "regime": "BULL",
      "reject_reason": "precision_gate_t3_low_ml_support",
      "risk_label": "EXCEPTION_LEADER",
      "secondary_themes": [],
      "source_profile": "exception_leader",
      "stock_name": "리노공업",
      "theme_inference_status": "inferred",
      "theme_source": "stock_master",
      "ticker": "058470.KQ",
      "tier_sort": 3
    },
    {
      "alpha_score": 58.0,
      "conviction_score": 38.4,
      "entry_reference_price": null,
      "exception_score": 91.0,
      "expires_at": "2026-04-13T01:48:34.501847+00:00",
      "generated_at": "2026-04-10T01:48:34.501847+00:00",
      "horizon_days": 3,
      "market_gate": "GREEN",
      "primary_theme": "2차전지",
      "prob_5": 19.5,
      "prob_clean": 28.2,
      "profile_adjustment": 22.0,
      "profile_avg_5d_pct": 16.832072266712306,
      "profile_confidence": 1.0,
      "profile_policy": "POSITIVE",
      "profile_signals": 9,
      "profile_win_5d_pct": 77.77777777777779,
      "real_trend": "DOWN",
      "reason": "exception_leader_watchlist",
      "regime": "BULL",
      "reject_reason": "precision_gate_t3_low_ml_support",
      "risk_label": "EXCEPTION_LEADER",
      "secondary_themes": [
        "철강/금속/소재"
      ],
      "source_profile": "exception_leader",
      "stock_name": "에코프로",
      "theme_inference_status": "inferred",
      "theme_source": "stock_master",
      "ticker": "086520.KQ",
      "tier_sort": 3
    },
    {
      "alpha_score": 55.0,
      "conviction_score": 37.7,
      "entry_reference_price": null,
      "exception_score": 91.0,
      "expires_at": "2026-04-13T01:48:34.501847+00:00",
      "generated_at": "2026-04-10T01:48:34.501847+00:00",
      "horizon_days": 3,
      "market_gate": "GREEN",
      "primary_theme": "로봇/자동화",
      "prob_5": 15.4,
      "prob_clean": 35.0,
      "profile_adjustment": 22.0,
      "profile_avg_5d_pct": 25.924452750348653,
      "profile_confidence": 1.0,
      "profile_policy": "POSITIVE",
      "profile_signals": 9,
      "profile_win_5d_pct": 100.0,
      "real_trend": "DOWN",
      "reason": "exception_leader_watchlist",
      "regime": "BULL",
      "reject_reason": "precision_gate_t3_low_ml_support",
      "risk_label": "EXCEPTION_LEADER",
      "secondary_themes": [],
      "source_profile": "exception_leader",
      "stock_name": "레인보우로보틱스",
      "theme_inference_status": "inferred",
      "theme_source": "stock_master",
      "ticker": "277810.KQ",
      "tier_sort": 3
    },
    {
      "alpha_score": 37.0,
      "conviction_score": 53.8,
      "entry_reference_price": null,
      "exception_score": 81.0,
      "expires_at": "2026-04-13T01:48:34.501847+00:00",
      "generated_at": "2026-04-10T01:48:34.501847+00:00",
      "horizon_days": 3,
      "market_gate": "GREEN",
      "primary_theme": "unclassified",
      "prob_5": 20.1,
      "prob_clean": 34.5,
      "profile_adjustment": 22.0,
      "profile_avg_5d_pct": 12.95487627365357,
      "profile_confidence": 0.903,
      "profile_policy": "POSITIVE",
      "profile_signals": 7,
      "profile_win_5d_pct": 100.0,
      "real_trend": "UP",
      "reason": "exception_leader_watchlist",
      "regime": "BULL",
      "reject_reason": "precision_gate_t3_low_ml_support",
      "risk_label": "EXCEPTION_LEADER",
      "secondary_themes": [],
      "source_profile": "exception_leader",
      "stock_name": "아모센스",
      "theme_inference_status": "blank",
      "theme_source": "stock_master",
      "ticker": "357580.KQ",
      "tier_sort": 3
    },
    {
      "alpha_score": 36.0,
      "conviction_score": 42.6,
      "entry_reference_price": null,
      "exception_score": 76.0,
      "expires_at": "2026-04-13T01:48:34.501847+00:00",
      "generated_at": "2026-04-10T01:48:34.501847+00:00",
      "horizon_days": 3,
      "market_gate": "GREEN",
      "primary_theme": "바이오/헬스케어",
      "prob_5": 15.9,
      "prob_clean": 17.9,
      "profile_adjustment": 22.0,
      "profile_avg_5d_pct": 39.22344668249112,
      "profile_confidence": 1.0,
      "profile_policy": "POSITIVE",
      "profile_signals": 9,
      "profile_win_5d_pct": 100.0,
      "real_trend": "UP",
      "reason": "exception_leader_watchlist",
      "regime": "BULL",
      "reject_reason": "precision_gate_t3_low_ml_support",
      "risk_label": "EXCEPTION_LEADER",
      "secondary_themes": [],
      "source_profile": "exception_leader",
      "stock_name": "삼천당제약",
      "theme_inference_status": "inferred",
      "theme_source": "stock_master",
      "ticker": "000250.KQ",
      "tier_sort": 3
    },
    {
      "alpha_score": 0.0,
      "conviction_score": 0.0,
      "entry_reference_price": null,
      "exception_score": 62.0,
      "expires_at": "2026-04-13T01:48:34.501847+00:00",
      "generated_at": "2026-04-10T01:48:34.501847+00:00",
      "horizon_days": 3,
      "market_gate": "GREEN",
      "primary_theme": "반도체",
      "prob_5": 0.0,
      "prob_clean": 0.0,
      "profile_adjustment": 22.0,
      "profile_avg_5d_pct": 16.43835616438356,
      "profile_confidence": 0.903,
      "profile_policy": "POSITIVE",
      "profile_signals": 7,
      "profile_win_5d_pct": 100.0,
      "real_trend": "",
      "reason": "exception_leader_watchlist",
      "regime": "BULL",
      "reject_reason": "kr_baseline_filter_fail",
      "risk_label": "EXCEPTION_LEADER",
      "secondary_themes": [],
      "source_profile": "exception_leader",
      "stock_name": "저스템",
      "theme_inference_status": "inferred",
      "theme_source": "stock_master",
      "ticker": "417840.KQ",
      "tier_sort": 3
    }
  ]
}