{
  "avoid_list": [],
  "decisions": [],
  "global_warnings": [
    {
      "code": "MARKET_POLICY_WATCHLIST_ONLY",
      "message": "Planner downgraded active recommendations to watchlist-only because learned policy for AMEX/GREEN is avoid.",
      "severity": "warning"
    }
  ],
  "produced_at": "2026-04-01T14:29:53.097009+00:00",
  "run_context": {
    "as_of_date": "2026-04-01",
    "code_version": "amex-moonshot-cycle",
    "created_at": "2026-04-01T14:29:47.325742+00:00",
    "market": "AMEX",
    "model_version": "amex-research-baseline",
    "run_id": "RUN-4DDB8F37",
    "strategy_version": "amex-moonshot-v1"
  },
  "watchlist": [
    "FTF",
    "TRX",
    "IDR"
  ],
  "watchlist_meta": [
    {
      "expires_at": "2026-04-03T14:29:53.510723+00:00",
      "generated_at": "2026-04-01T14:29:53.510723+00:00",
      "horizon_days": 2,
      "market_gate": "GREEN",
      "policy_avg_5d_pct": -1.98,
      "policy_mode": "avoid",
      "policy_win_5d_pct": 46.88,
      "reason": "market_policy_watchlist_only",
      "risk_label": "WATCHLIST_ONLY",
      "source_profile": "learned_market_policy",
      "stock_name": "FTF",
      "ticker": "FTF"
    },
    {
      "expires_at": "2026-04-03T14:29:53.510723+00:00",
      "generated_at": "2026-04-01T14:29:53.510723+00:00",
      "horizon_days": 2,
      "market_gate": "GREEN",
      "policy_avg_5d_pct": -1.98,
      "policy_mode": "avoid",
      "policy_win_5d_pct": 46.88,
      "reason": "market_policy_watchlist_only",
      "risk_label": "WATCHLIST_ONLY",
      "source_profile": "learned_market_policy",
      "stock_name": "TRX",
      "ticker": "TRX"
    },
    {
      "expires_at": "2026-04-03T14:29:53.510723+00:00",
      "generated_at": "2026-04-01T14:29:53.510723+00:00",
      "horizon_days": 2,
      "market_gate": "GREEN",
      "policy_avg_5d_pct": -1.98,
      "policy_mode": "avoid",
      "policy_win_5d_pct": 46.88,
      "reason": "market_policy_watchlist_only",
      "risk_label": "WATCHLIST_ONLY",
      "source_profile": "learned_market_policy",
      "stock_name": "IDR",
      "ticker": "IDR"
    }
  ]
}