{
  "avoid_list": [
    "AMZN",
    "NVDA",
    "AAPL"
  ],
  "decisions": [
    {
      "confidence": 0.579,
      "decision": "AVOID",
      "evidence_refs": [
        "scanner_handoff.json",
        "aggregation_handoff.json",
        "backtest_handoff.json",
        "market_context_handoff.json"
      ],
      "priority_rank": 1,
      "rationale": [
        "scanner_score=45.8",
        "rank=1",
        "Strategy: 🚀 Momentum",
        "Trend: DOWN"
      ],
      "realized_outcome_ref": "realized_outcomes.json#AMZN",
      "ticker": "AMZN",
      "warnings": [
        {
          "code": "LOW_DECISION_SCORE",
          "message": "AMZN has low decision score (45.8).",
          "severity": "warning"
        }
      ]
    },
    {
      "confidence": 0.509,
      "decision": "AVOID",
      "evidence_refs": [
        "scanner_handoff.json",
        "aggregation_handoff.json",
        "backtest_handoff.json",
        "market_context_handoff.json"
      ],
      "priority_rank": 2,
      "rationale": [
        "scanner_score=31.8",
        "rank=2",
        "Strategy: 🚀 Momentum",
        "Trend: DOWN"
      ],
      "realized_outcome_ref": "realized_outcomes.json#NVDA",
      "ticker": "NVDA",
      "warnings": [
        {
          "code": "LOW_DECISION_SCORE",
          "message": "NVDA has low decision score (31.8).",
          "severity": "warning"
        }
      ]
    },
    {
      "confidence": 0.478,
      "decision": "AVOID",
      "evidence_refs": [
        "scanner_handoff.json",
        "aggregation_handoff.json",
        "backtest_handoff.json",
        "market_context_handoff.json"
      ],
      "priority_rank": 3,
      "rationale": [
        "scanner_score=25.6",
        "rank=3",
        "Strategy: 🚀 Momentum",
        "Trend: DOWN"
      ],
      "realized_outcome_ref": "realized_outcomes.json#AAPL",
      "ticker": "AAPL",
      "warnings": [
        {
          "code": "LOW_DECISION_SCORE",
          "message": "AAPL has low decision score (25.6).",
          "severity": "warning"
        }
      ]
    }
  ],
  "global_warnings": [
    {
      "code": "LOW_QUALITY_INPUT",
      "message": "Planner confidence reduced due to weak candidate ratio.",
      "severity": "warning"
    }
  ],
  "produced_at": "2026-03-30T16:31:16.194529+00:00",
  "run_context": {
    "as_of_date": "2026-03-31",
    "code_version": "non-ui-scan-v1",
    "created_at": "2026-03-30T16:31:03.800208+00:00",
    "market": "NASDAQ",
    "model_version": "legacy",
    "run_id": "RUN-2553D697",
    "strategy_version": "legacy-cli-v1"
  },
  "watchlist": [],
  "watchlist_meta": []
}